{
  "$schema": "https://mpm.plugin.morino.party/schema/repository-index/v1.json",
  "schemaVersion": 1,
  "name": "morinoparty-paper-spark",
  "plugins": {
    "CarbonChat": {
      "id": "CarbonChat",
      "website": "https://modrinth.com/plugin/carbon",
      "source": "https://github.com/Hexaoxide/Carbon",
      "license": "GPL-3.0-only",
      "repositories": [
        {
          "type": "modrinth",
          "id": "QzooIsZI",
          "versionModifier": "(0|[1-9]\\d*)\\.(0|[1-9]\\d*)\\.(0|[1-9]\\d*)-beta\\.(0|[1-9]\\d*)",
          "beta": {
            "versionModifier": "(0|[1-9]\\d*)\\.(0|[1-9]\\d*)\\.(0|[1-9]\\d*)-beta\\.(0|[1-9]\\d*)",
            "useUpstreamLabel": true
          }
        }
      ],
      "defaultVersion": "tag:beta"
    },
    "SlotMachine": {
      "id": "SlotMachine",
      "website": "https://modrinth.com/plugin/slotmachine",
      "repositories": [
        {
          "type": "modrinth",
          "id": "TZJKvIil"
        }
      ]
    }
  },
  "children": []
}
